Title,Year,Decision,Notes
The Impact of Automated Writing Evaluation on Writing Gains,2025,include,"{""c1"": {""status"": ""pass"", ""evidence"": ""Participants are 105 first-year university students in Belgium described as English as a foreign language (EFL) students, clearly indicating L2 English learners in an EFL context with focus on English writing skills.""}, ""c2"": {""status"": ""pass"", ""evidence"": ""The study examines the effectiveness of ChatGPT, explicitly a large language model, in improving English writing skills over a nine-week intervention. It compares a teacher-feedback-only group with a group using ChatGPT alongside teacher feedback, indicating an experimental design integrating an LLM into writing instruction.""}, ""c3"": {""status"": ""pass"", ""evidence"": ""The primary focus is on writing competence, specifically syntactic and lexical complexity as key dimensions of writing development, and on text length and complexity. ChatGPT is used as part of a pedagogical writing intervention, not merely as an automated scoring tool.""}, ""c4"": {""status"": ""pass"", ""evidence"": ""The study reports quantifiable writing outcomes, including measures of syntactic and lexical complexity and text length, to assess ChatGPT\u2019s impact on writing gains and sustained writing improvement over a nine-week period.""}}"
Exploring the Impact of Ai Technologies on Efl Writing Proficiency,2025,exclude,"{""c1"": {""status"": ""fail"", ""evidence"": ""The participants are Saudi EFL teachers at King Saud University, not L2 English learners. The study focuses on teachers\u2019 perspectives rather than learner data or learner outcomes.""}, ""c2"": {""status"": ""fail"", ""evidence"": ""Although ChatGPT (an LLM) is mentioned, the study uses a descriptive survey design to explore teachers\u2019 perceptions. There is no experimental or quasi-experimental intervention integrating ChatGPT into learners\u2019 writing instruction or processes.""}, ""c3"": {""status"": ""fail"", ""evidence"": ""The focus is on perceived merits and challenges of using ChatGPT in writing classes, not on an implemented pedagogical intervention targeting writing competence. It is essentially an attitudinal/perception study.""}, ""c4"": {""status"": ""fail"", ""evidence"": ""No quantifiable learner writing outcomes are reported. The study gathers questionnaire data from teachers about perceptions; there are no measured changes in students\u2019 writing performance or related variables.""}}"
Cognitive Offload Instruction with Generative Ai: a Quasi-experimental Study on Critical Thinking Gains in English Writing,2025,unsure,"{""c1"": {""status"": ""unclear"", ""evidence"": ""Participants are described as \u201cfirst-year university students\u201d in \u201cEnglish essay writing\u201d and the conclusion mentions \u201csecond-language writing contexts,\u201d but it is not explicitly stated that these particular participants are L2 English learners (ESL/EFL/ELL). The population could be native or mixed, so eligibility is uncertain.""}, ""c2"": {""status"": ""unclear"", ""evidence"": ""The abstract refers to \u201cgenerative AI-enabled cognitive offload instruction\u201d and \u201cgenerative AI tools,\u201d but does not specify whether these are large language models (e.g., ChatGPT/GPT-4 or similar transformer-based generative models) versus other generative systems. Without explicit mention of LLM-based tools, it is unclear if the intervention meets the LLM criterion.""}, ""c3"": {""status"": ""pass"", ""evidence"": ""The context is English essay writing, with AI used for brainstorming, co-revision, and other writing-related processes. Outcomes include essay quality (logical coherence, evidence use, originality), indicating a primary focus on writing competence and writing-related variables rather than solely on assessment or non-pedagogical evaluation.""}, ""c4"": {""status"": ""pass"", ""evidence"": ""The study uses a quasi-experimental design comparing traditional vs AI-augmented instruction and reports quantifiable outcomes: standardized critical thinking assessments and measurable essay quality indicators (logical coherence, evidence use, originality). These constitute quantifiable writing-related outcome metrics.""}}"
Revising with Intelligence: Chatgpt Feedback and Its Impact on Efl Students’ Revision and Self-efficacy,2025,include,"{""c1"": {""status"": ""pass"", ""evidence"": ""Participants are explicitly described as 82 university-level EFL students, i.e., English as a Foreign Language learners, and the context is English writing development. This matches the required L2 English learner population.""}, ""c2"": {""status"": ""pass"", ""evidence"": ""The study uses a quasi-experimental design with two groups: a ChatGPT-supported writing group and a teacher-supported writing group. ChatGPT, a large language model, is integrated as the feedback provider in the writing intervention.""}, ""c3"": {""status"": ""pass"", ""evidence"": ""The focus is on writing development and revision in a process-based writing instruction context. Outcomes include revision productivity, macro-level and content-based revisions, and writing self-efficacy related to revision and discourse organization, all of which are writing-related variables.""}, ""c4"": {""status"": ""pass"", ""evidence"": ""The study reports quantitative outcomes: significant increases in revision productivity, more macro-level and content-based revisions, and higher self-efficacy gains across three dimensions. These are structured, measurable outcomes of the LLM-mediated writing intervention.""}}"
Traditional Strategies and Ai-integrated Strategies in Learning English among Efl Omani Students,2025,exclude,"{""c1"": {""status"": ""pass"", ""evidence"": ""Participants are EFL Omani students at a public Omani university, clearly L2 English learners in an EFL context.""}, ""c2"": {""status"": ""fail"", ""evidence"": ""The study is a survey using a questionnaire (Likert-scale items) about traditional and AI-integrated learning strategies. It does not describe an experimental or quasi-experimental intervention integrating a specific LLM (e.g., ChatGPT, GPT-4) into instruction; AI tools are referenced generically as strategies, not as a tested LLM-based intervention.""}, ""c3"": {""status"": ""fail"", ""evidence"": ""The focus is on general learning strategies (listening, speaking, pronunciation, grammar, writing) and gender/academic level differences in their use. Writing is only one of several skills and is not the primary focus of a pedagogical intervention; the study is about strategy use, not a writing-focused instructional context.""}, ""c4"": {""status"": ""fail"", ""evidence"": ""Outcomes are self-reported frequency of using strategies (Likert scores), not quantifiable writing performance measures. There is no assessment of changes in writing competence or writing-related performance resulting from an LLM-mediated intervention.""}}"
Design Opportunities for Explainable Ai Paraphrasing Tools: a User Study with Non-native English Speakers,2025,exclude,"{""c1"": {""status"": ""unclear"", ""evidence"": ""Participants are described as non-native English speakers (NNESs), but the abstract does not specify whether they are in ESL/EFL/ELL learning contexts or formal L2 English learners, nor their educational setting.""}, ""c2"": {""status"": ""unclear"", ""evidence"": ""The study uses ParaScope, an AI paraphrasing assistant, but the abstract does not state that it is based on a large language model (e.g., ChatGPT/GPT-style transformer). It could be another type of AI paraphraser, so LLM integration cannot be confirmed from the abstract alone.""}, ""c3"": {""status"": ""fail"", ""evidence"": ""The focus is on interaction with AI-generated paraphrases, information aids, and design implications for explainable AI tools. While related to writing support (paraphrasing, confidence, autonomy, efficiency), it is framed as a user study and design exploration rather than a pedagogical writing intervention aimed at improving writing competence in an instructional context.""}, ""c4"": {""status"": ""fail"", ""evidence"": ""The abstract reports outcomes such as confidence, autonomy, and writing efficiency, but does not mention any quantifiable writing quality metrics or experimental evaluation of writing performance. It centers on user preferences and interaction patterns, not measured writing outcomes.""}}"
The Role of Ai in Improving Writing Skills of Indian Undergraduate Efl Learners: a Research Review,2025,exclude,"{""c1"": {""status"": ""pass"", ""evidence"": ""The abstract focuses on Indian undergraduate EFL learners, clearly identifying L2 English learners in an EFL context.""}, ""c2"": {""status"": ""fail"", ""evidence"": ""The article is explicitly described as a research review examining the potential of AI writing tools; it does not report an experimental or quasi-experimental intervention, nor does it specify use of LLM-based tools like ChatGPT in an implemented study.""}, ""c3"": {""status"": ""pass"", ""evidence"": ""The primary focus is on improving writing skills and EFL writing training, discussing how AI tools might support writing-related competencies.""}, ""c4"": {""status"": ""fail"", ""evidence"": ""As a review article, it does not report original quantitative writing outcome metrics from an intervention; it discusses potential benefits and challenges conceptually and calls for further investigation.""}}"
Coachgpt: a Scaffolding-based Academic Writing Assistant,2025,unsure,"{""c1"": {""status"": ""unclear"", ""evidence"": ""The abstract mentions that academic writing can be overwhelming 'particularly when writing in a second language,' but it does not specify that the study participants are L2 English learners in ESL/EFL/ELL contexts, nor does it state the target language of the writing tasks. The population and language focus remain ambiguous.""}, ""c2"": {""status"": ""pass"", ""evidence"": ""The study develops CoachGPT, an AI agent-based web application that 'provides real-time feedback and suggestions using large language models.' This is an LLM-based writing assistant integrated into the writing process, and the description implies an intervention-like use (scaffolding, sub-tasks, feedback) rather than mere evaluation of the tool.""}, ""c3"": {""status"": ""pass"", ""evidence"": ""The primary focus is on 'academic writing skills' and assisting 'academic writing' through scaffolding and feedback. The tool is explicitly a 'writing assistant,' and the context is improving or supporting writing competence, not automated scoring or non-pedagogical evaluation.""}, ""c4"": {""status"": ""unclear"", ""evidence"": ""The abstract states that 'Our user studies prove the usefulness of CoachGPT and the potential of large language models for academic writing,' but it does not specify whether these user studies include quantifiable writing outcome metrics (e.g., writing scores, quality ratings, measurable improvement) versus only usability or perceived usefulness. No explicit experimental measures of writing performance are described.""}}"
Chatgpt for English Writing: a Qualitative Inquiry among English Major Students at Thai Higher Education,2025,exclude,"{""c1"": {""status"": ""pass"", ""evidence"": ""Participants are seven fourth-year English majors in Thailand, explicitly described as Thai English as a Foreign Language (EFL) students, so the population is L2 English learners in an EFL context.""}, ""c2"": {""status"": ""fail"", ""evidence"": ""Although the study concerns ChatGPT, it is a qualitative inquiry into students\u2019 attitudes and perceptions. There is no indication of an experimental or quasi-experimental design integrating ChatGPT as a structured writing intervention; rather, it explores perceived roles and experiences.""}, ""c3"": {""status"": ""pass"", ""evidence"": ""The focus is on ChatGPT\u2019s roles in English writing, including vocabulary, grammar, and content organization, which are writing-related variables in an L2 context.""}, ""c4"": {""status"": ""fail"", ""evidence"": ""The study is explicitly qualitative, using semi-structured interviews and thematic analysis to explore attitudes and perceptions. It does not report quantifiable writing outcome metrics or measure changes in writing performance following an intervention.""}}"
The Collaboration of Ai and Teacher in Feedback Provision and Its Impact on Efl Learner’s Argumentative Writing,2025,exclude,"{""c1"": {""status"": ""pass"", ""evidence"": ""Participants are 28 tenth-grade EFL learners focusing on English argumentative writing, which fits the target population of L2 English learners in an EFL context.""}, ""c2"": {""status"": ""fail"", ""evidence"": ""The intervention uses DeepL Write as the AI tool. DeepL Write is primarily a machine translation/AI writing assistance tool and is not clearly identified as an LLM-based (transformer generative) system like ChatGPT, GPT-4, Gemini, etc. The abstract does not indicate use of a large language model; thus it does not meet the specified LLM-based intervention criterion.""}, ""c3"": {""status"": ""pass"", ""evidence"": ""The study explicitly targets English argumentative writing and examines the impact of AI and teacher feedback on writing quality (lexical, grammatical, content, coherence, cohesion), which aligns with a primary focus on writing competence.""}, ""c4"": {""status"": ""pass"", ""evidence"": ""The study compares writing quality across three drafts using Coh-Metrix, providing quantifiable outcome measures of writing performance under AI-only and teacher+AI feedback conditions.""}}"
Assigning Cefr-j Levels to English Learners’ Writing: an Approach Using Lexical Metrics and Generative Ai,2025,exclude,"{""c1"": {""status"": ""pass"", ""evidence"": ""The system is designed for assessing English learners\u2019 writing proficiency in an EFL context (CEFR-J, particularly in Japan), so the population is L2 English learners.""}, ""c2"": {""status"": ""fail"", ""evidence"": ""The study develops and validates an automated writing level analyzer (CWLA) using lexical metrics and AI-based scoring. It is an assessment tool validation study, not an experimental or quasi-experimental pedagogical intervention integrating an LLM into writing instruction or writing processes.""}, ""c3"": {""status"": ""fail"", ""evidence"": ""The primary focus is on automated assessment of writing proficiency (scoring alignment with CEFR-J, correlation with human ratings), i.e., functionality as an automated scoring system. There is no described instructional or intervention context targeting writing competence development.""}, ""c4"": {""status"": ""fail"", ""evidence"": ""The outcomes reported are tool validation metrics (correlation with human ratings, entropy analysis, expert agreement). There is no experimental or quasi-experimental writing intervention and no quantifiable pre/post or comparative writing outcome measures for learners.""}}"
Modeling Chinese Efl Learners’ Intention to Use Generative Ai for L2 Writing through an Integrated Model of the Tam and Ttf,2025,exclude,"{""c1"": {""status"": ""pass"", ""evidence"": ""Participants are Chinese EFL learners (304 university students in China) using generative AI for L2 English writing, clearly fitting an EFL/ELL English-learning context.""}, ""c2"": {""status"": ""fail"", ""evidence"": ""The study uses a survey and structural equation modeling (TAM + TTF) to examine intention to use generative AI. There is no experimental or quasi-experimental pedagogical intervention integrating a specific LLM into writing instruction or processes.""}, ""c3"": {""status"": ""fail"", ""evidence"": ""The focus is on technology acceptance and task\u2013technology fit for generative AI as an English writing assistant, not on an implemented writing intervention or instructional context where writing competence is directly targeted.""}, ""c4"": {""status"": ""fail"", ""evidence"": ""No quantifiable writing outcome metrics are reported. Outcomes are psychological/behavioral (perceived usefulness, ease of use, attitude, behavioral intention), not measures of writing performance or related writing skills.""}}"
"A Mixed-methods Study on the Use of Chatgpt in the Pre-writing Stage: Efl Learners’ Utilization Patterns, Affective Engagement, and Writing Performance",2025,include,"{""c1"": {""status"": ""pass"", ""evidence"": ""Participants are 56 first-year university students described explicitly as English as a Foreign Language (EFL) learners. The focus is on English argumentative writing tasks, fitting ESL/EFL/ELL L2 English contexts.""}, ""c2"": {""status"": ""pass"", ""evidence"": ""The study uses ChatGPT, a large language model, as support in the pre-writing stage. It employs a mixed-methods design with two writing tasks (with vs. without ChatGPT), constituting an experimental/quasi-experimental intervention integrating an LLM into the writing process.""}, ""c3"": {""status"": ""pass"", ""evidence"": ""The primary focus is on writing competence and related variables: pre-writing strategies, text quality, and affective engagement during writing. ChatGPT is used pedagogically in the planning stage of argumentative writing, not merely for automated scoring or system evaluation.""}, ""c4"": {""status"": ""pass"", ""evidence"": ""The abstract reports quantifiable writing outcomes: learners \u2018produced better text quality\u2019 in the ChatGPT condition and a \u2018moderate positive correlation\u2019 between affective engagement and overall writing performance. This indicates measured, comparative writing performance data as part of the intervention evaluation.""}}"
Predicting Kazakhstani Tefl Students’ Continuance Intention towards Using Chatgpt in Academic Writing,2025,exclude,"{""c1"": {""status"": ""pass"", ""evidence"": ""Participants are TEFL (Teaching English as a Foreign Language) students at two Kazakhstani universities, i.e., L2 English learners in an EFL context, and the focus is on academic writing in English.""}, ""c2"": {""status"": ""fail"", ""evidence"": ""Although ChatGPT (an LLM) is the focal tool, the study is not an experimental or quasi-experimental intervention in writing instruction. It examines perceptions and continuance intention via a survey model, not a structured pedagogical writing intervention using ChatGPT.""}, ""c3"": {""status"": ""fail"", ""evidence"": ""The primary focus is on technology acceptance variables (perceived usefulness, ease of use, satisfaction, continuance intention) rather than on developing or assessing writing competence through an instructional intervention. It is not a writing pedagogy study but a usage-intention study in an academic writing context.""}, ""c4"": {""status"": ""fail"", ""evidence"": ""No quantifiable writing outcome metrics (e.g., writing scores, text quality measures) are reported. Outcomes are psychological/behavioral (perceptions, satisfaction, continuance intention) and qualitative comments, not measured changes in writing performance.""}}"
Exploring the Potential of Genai for Personalised English Teaching: Learners' Experiences and Perceptions,2025,exclude,"{""c1"": {""status"": ""pass"", ""evidence"": ""Participants are first-year English for Academic Purposes students, i.e., L2 learners in an EAP/ESL-type context, and the focus is on English language competencies.""}, ""c2"": {""status"": ""fail"", ""evidence"": ""The study focuses on learners\u2019 use of GenAI tools such as Grammarly and Quillbot. These are not clearly described as LLM-based generative tools in an instructional intervention; rather, they are general support tools whose underlying models may not be transformer-based LLMs as required. There is no explicit experimental or quasi-experimental LLM-mediated writing instruction design.""}, ""c3"": {""status"": ""unclear"", ""evidence"": ""The abstract mentions L2 writing instruction and improvements in grammar, writing, vocabulary, and reading, but the primary emphasis is on experiences and perceptions of GenAI tools rather than a structured pedagogical writing intervention or writing competence as the central outcome.""}, ""c4"": {""status"": ""fail"", ""evidence"": ""Although the study uses surveys and interviews and reports usage rates (e.g., 66.7% regularly used the tools), it does not report quantifiable writing outcome metrics (e.g., pre/post writing scores, rubric-based writing performance). The focus is on perceived helpfulness and experiences, not measured changes in writing performance.""}}"
The Impact of Integrating Chatgpt with Teachers’ Feedback on Efl Writing Skills,2025,include,"{""c1"": {""status"": ""pass"", ""evidence"": ""Participants were 68 intermediate Iranian EFL learners, explicitly identified as English as a foreign language learners working on IELTS Task 2 argumentative essays. The focus is clearly on English writing.""}, ""c2"": {""status"": ""pass"", ""evidence"": ""The intervention integrates ChatGPT, described as a state-of-the-art AI chatbot, with teacher feedback to provide individualized writing feedback. Learners were randomly assigned to ChatGPT+teacher feedback vs teacher-only feedback, indicating an experimental design using an LLM-based tool in writing instruction.""}, ""c3"": {""status"": ""pass"", ""evidence"": ""The primary focus is on EFL writing skills and improvement in IELTS Task 2 argumentative essays. ChatGPT is used pedagogically to provide feedback on writing, not as an automated scoring tool. Outcomes relate directly to writing competence (task achievement, coherence, cohesion, vocabulary, grammar).""}, ""c4"": {""status"": ""pass"", ""evidence"": ""The study reports quantifiable writing outcomes: Paired Samples t-Test results showing significantly greater improvement for the ChatGPT+teacher group across IELTS scoring criteria (task achievement, coherence, cohesion, vocabulary, grammar range and accuracy). These are structured, measurable writing outcomes.""}}"
Mobile Ai Tools in Language Learning: Efl Students’ Acceptance of Chatgpt for Writing Brainstorming,2025,exclude,"{""c1"": {""status"": ""pass"", ""evidence"": ""Participants are 257 EFL students at a Vietnamese university, clearly indicating L2 English learners in an EFL context.""}, ""c2"": {""status"": ""fail"", ""evidence"": ""Although ChatGPT (an LLM) is used for writing brainstorming, the study focuses on students\u2019 acceptance and perceptions. There is no indication of an experimental or quasi-experimental instructional intervention design; rather, it is a survey of existing use.""}, ""c3"": {""status"": ""pass"", ""evidence"": ""The context is explicitly writing-related: use of ChatGPT for brainstorming in a writing class and support for enhancing writing quality and skills.""}, ""c4"": {""status"": ""fail"", ""evidence"": ""The study uses a Likert-scale questionnaire and interviews to examine acceptance, perceptions, advantages, and disadvantages. It does not report quantifiable writing performance outcomes (e.g., scores, rubric-based writing measures) from an intervention, only self-reported perceptions of impact.""}}"
The Development and Validation of a Scale on Student Ai Literacy in L2 Writing: a Domain-specific Perspective,2025,exclude,"{""c1"": {""status"": ""pass"", ""evidence"": ""Participants are 435 and 350 Chinese university students engaged in L2 writing, implying they are L2 English learners in an EFL context. The scale is explicitly for L2 writing, and in Chinese university contexts this typically refers to English.""}, ""c2"": {""status"": ""fail"", ""evidence"": ""The study develops and validates a self-report scale of student AI literacy in L2 writing. It does not describe an experimental or quasi-experimental intervention integrating a specific LLM (e.g., ChatGPT, GPT-4) into writing instruction or processes; rather, it is a psychometric instrument development study.""}, ""c3"": {""status"": ""fail"", ""evidence"": ""The primary focus is on measuring AI literacy (understanding, use, evaluation, ethics) via a questionnaire, not on implementing or evaluating a writing intervention or instructional context that targets writing competence or writing-related performance outcomes.""}, ""c4"": {""status"": ""fail"", ""evidence"": ""No quantifiable writing outcome metrics (e.g., writing scores, text quality measures) are reported. The outcomes are psychometric properties of the AI literacy scale (factor structure, reliability), not changes in writing performance following an LLM-mediated intervention.""}}"
Students' Perceptions and Usage Patterns of Chatgpt as an Automated Writing Evaluation (awe) Tool,2025,exclude,"{""c1"": {""status"": ""pass"", ""evidence"": ""Participants were 47 graduate EFL students at a university in Hong Kong, clearly indicating L2 English learners in an EFL context.""}, ""c2"": {""status"": ""fail"", ""evidence"": ""Although ChatGPT (an LLM) is used as an Automated Writing Evaluation tool, the study is descriptive, focusing on how students interact with it and their perceptions. There is no indication of an experimental or quasi-experimental instructional intervention integrating ChatGPT into writing instruction.""}, ""c3"": {""status"": ""fail"", ""evidence"": ""The primary focus is on perceptions and usage patterns of ChatGPT as an AWE tool, not on a structured pedagogical writing intervention or systematic integration into writing instruction aimed at improving competence.""}, ""c4"": {""status"": ""fail"", ""evidence"": ""Data were collected via a questionnaire survey about usage patterns and perceptions. The abstract does not report any quantifiable writing outcome measures (e.g., changes in writing scores, quality, accuracy) resulting from ChatGPT use.""}}"
