Title,Year,Decision,Notes
The Design and Evaluation of an Interactive Ai Companion for Foreign Language Writing,2025,exclude,"{""c1"": {""status"": ""unclear"", ""evidence"": ""The abstract refers to \u201cforeign language writing\u201d learners but does not specify that the target language is English or that the context is ESL/EFL/ELL. The population could involve any foreign language, so it is not clear that L2 English learners are the focus.""}, ""c2"": {""status"": ""unclear"", ""evidence"": ""The study describes an \u201cinteractive AI companion\u201d and \u201cAI chatbot\u201d for writing, but it does not specify that it is based on a large language model (e.g., ChatGPT, GPT-4, transformer-based generative model). It could be another type of AI system, so its status as an LLM intervention is uncertain.""}, ""c3"": {""status"": ""pass"", ""evidence"": ""The AI companion is explicitly designed as a writing companion to support a process-oriented approach to foreign language writing, emphasizing writing as a collaborative process and focusing on textual conventions. The primary pedagogical focus is on writing processes and competence.""}, ""c4"": {""status"": ""fail"", ""evidence"": ""Outcomes reported are perceptions and psychological constructs (writing self-efficacy, anxiety, self-regulation, anthropomorphism, teaching presence, enjoyment). The abstract does not indicate any quantifiable writing performance metrics (e.g., text quality, accuracy, complexity) were measured, only self-reported perceptions.""}}"
Exploring Ai-assistance in L2 Chinese Writing with Standardized Assessment Tasks,2025,exclude,"{""c1"": {""status"": ""fail"", ""evidence"": ""Participants are 'university-level Mandarin Chinese foreign language students' completing AP Chinese writing tasks. The target language and writing focus are Mandarin Chinese, not English. The review requires L2 English learners in ESL/EFL/ELL contexts with data focused on English.""}, ""c2"": {""status"": ""pass"", ""evidence"": ""The study allows students to use ChatGPT, a large language model, for assistance on one of the writing prompts and compares performance with and without ChatGPT. This constitutes an experimental design integrating an LLM into the writing process.""}, ""c3"": {""status"": ""pass"", ""evidence"": ""The primary focus is on L2 writing performance in standardized assessment tasks, examining how ChatGPT supports completion of writing tasks and which aspects students rely on (e.g., vocabulary, translation). This aligns with writing competence and writing-related variables.""}, ""c4"": {""status"": ""pass"", ""evidence"": ""The study compares writing scores with and without ChatGPT, using standardized prompts and professional raters, and reports that ChatGPT assistance resulted in higher scores. These are quantifiable writing outcome metrics.""}}"
Generative Ai and English Essay Writing: Exploring the Role of Chatgpt in Enhancing Learners' Task Engagement,2025,exclude,"{""c1"": {""status"": ""pass"", ""evidence"": ""Participants are 60 undergraduate learners writing English argumentative essays in an English as a Foreign Language (EFL) context, clearly indicating L2 English learners.""}, ""c2"": {""status"": ""pass"", ""evidence"": ""The study uses a generative AI-based tool, ChatGPT, within a mixed-methods experimental design with control and experimental groups over a 2\u2011month instructional period, indicating an LLM-based writing intervention.""}, ""c3"": {""status"": ""fail"", ""evidence"": ""The primary focus is on learners\u2019 task engagement in English essay writing (motivation, anxiety, interest, partnership, perceived competence), not on writing competence or writing-related performance variables. The abstract does not mention assessing writing quality, accuracy, or other competence-related outcomes.""}, ""c4"": {""status"": ""fail"", ""evidence"": ""Quantitative outcomes reported are engagement levels during essay writing tasks. There is no indication of quantifiable writing performance metrics (e.g., scores, complexity, accuracy, organization) to evaluate the effectiveness of the intervention on writing quality.""}}"
Generative Ai in Academic Writing: Exploring Esl Students' Strategies and Performance,2025,exclude,"{""c1"": {""status"": ""pass"", ""evidence"": ""Participants are 13 university students in Malaysia doing academic writing in English, which reasonably indicates an ESL/EFL context with English as the target language.""}, ""c2"": {""status"": ""fail"", ""evidence"": ""The study is described as an exploratory case study of students\u2019 self-reported GenAI-assisted writing strategies using ChatGPT. There is no indication of an experimental or quasi-experimental instructional intervention; rather, it observes existing usage without a designed LLM-based teaching or practice intervention.""}, ""c3"": {""status"": ""pass"", ""evidence"": ""The focus is explicitly on GenAI-assisted academic writing in English and how students incorporate ChatGPT into their writing, which aligns with writing competence and writing-related variables.""}, ""c4"": {""status"": ""fail"", ""evidence"": ""The abstract mentions \u2018effects on their output\u2019 and \u2018writing performance\u2019 but only reports a thematic analysis of self-reported usage and strategies. It does not indicate any quantitative or experimental writing outcome measures; outcomes appear to be qualitative themes rather than measurable writing gains.""}}"
English Language Teaching (elt) in the Digital Age: a Meta-thematic Analysis of Artificial Intelligence Research,2025,exclude,"{""c1"": {""status"": ""unclear"", ""evidence"": ""The article is a meta-analysis of AI in EFL instruction, so it likely involves EFL learners in the underlying studies, but the abstract does not specify participant details or confirm that the focus is on L2 English learners\u2019 data rather than broader ELT contexts.""}, ""c2"": {""status"": ""fail"", ""evidence"": ""This is a meta-thematic/meta-analysis of prior AI-in-ELT research, not an experimental or quasi-experimental primary study integrating a specific LLM (e.g., ChatGPT, GPT-4) into writing instruction. It synthesizes existing work and does not itself implement an LLM-based intervention.""}, ""c3"": {""status"": ""fail"", ""evidence"": ""The focus is broad\u2014AI in English language teaching generally. While it notes that AI can facilitate academic writing, writing is only one of several themes (motivation, personalized learning, ethical/pedagogical/technical issues), not the primary focus of a concrete intervention.""}, ""c4"": {""status"": ""fail"", ""evidence"": ""The study uses content analysis of existing research and reports thematic findings (e.g., motivation, personalized learning, academic writing facilitation). It does not report quantifiable writing outcome metrics from an LLM-mediated writing intervention.""}}"
Incorporating Chatgpt into Genre-based Instruction for Argumentative Writing among Efl College Students,2025,include,"{""c1"": {""status"": ""pass"", ""evidence"": ""Participants were 48 first-year EFL English majors at universities of technology in Taiwan. This clearly identifies them as L2 English learners in an EFL context, with English as the target language.""}, ""c2"": {""status"": ""pass"", ""evidence"": ""The study explicitly examines \u201cChatGPT-integrated genre-based instruction\u201d over a six-week experiment. ChatGPT is a large language model, and it is integrated into the instructional design, satisfying the LLM-based intervention requirement.""}, ""c3"": {""status"": ""pass"", ""evidence"": ""The primary focus is on argumentative writing performance and related constructs (willingness to write, perceptions). ChatGPT is used pedagogically for idea generation and feedback within writing instruction, not merely for automated scoring.""}, ""c4"": {""status"": ""pass"", ""evidence"": ""The study reports pre- and post-writing tests and pre- and post-WtW questionnaires, with findings such as \u201csignificant improvements in some moves after the instruction\u201d and changes in WtW scores. These constitute quantifiable writing outcome metrics.""}}"
Empowering Authorship with Ai: a Novel Academic Writing Technology for Authorial Voice,2025,unsure,"{""c1"": {""status"": ""pass"", ""evidence"": ""Participants are explicitly described as \u201c23 first-year ESL students at a Fijian university,\u201d and the focus is on their academic writing in English, satisfying the L2 English learner population criterion.""}, ""c2"": {""status"": ""unclear"", ""evidence"": ""The abstract states that AVATAR is an intelligent tutoring system integrating Technology-Enhanced Learning and Generative Artificial Intelligence (GAI). However, it does not specify whether the GAI component is a large language model (e.g., ChatGPT/GPT-like transformer-based generative model) or another form of AI. Without explicit indication that AVATAR uses an LLM, it is unclear if this meets the LLM-based intervention requirement.""}, ""c3"": {""status"": ""pass"", ""evidence"": ""The study\u2019s primary focus is on academic writing, specifically the development of authorial voice in argumentative essays. AVATAR is used while students work on an argumentative essay, and the intervention is clearly pedagogical and writing-focused rather than automated scoring or system benchmarking.""}, ""c4"": {""status"": ""pass"", ""evidence"": ""The study reports quantifiable outcomes: statistically significant improvement in authorial voice performance, increased authorial voice strength scores for essays edited in AVATAR, and higher post-use authorship survey results and self-scores. These constitute measurable writing-related outcomes linked to the intervention.""}}"
Are Ai Tools Effective in Reducing Cognitive Load or Boosting Writing Self-efficacy for L2 Postgraduates?,2025,exclude,"{""c1"": {""status"": ""unclear"", ""evidence"": ""Participants are described as postgraduate students engaged in research-based L2 writing, but the abstract does not specify that the target language is English or that the context is ESL/EFL/ELL. It only states \u201csecond-language (L2) writing,\u201d so the population\u2019s L2 and context remain unclear.""}, ""c2"": {""status"": ""unclear"", ""evidence"": ""The study investigates \u201cAI tools\u201d in L2 writing but does not specify that these are large language models (e.g., ChatGPT, GPT-4) or transformer-based generative systems. The type of AI (LLM vs. other tools such as machine translation, summarizers, or grammar checkers) is not identified, so it is impossible to confirm that LLMs are the intervention.""}, ""c3"": {""status"": ""fail"", ""evidence"": ""The primary outcomes are writing self-efficacy and cognitive load. The abstract does not indicate that writing competence, text quality, or other writing performance variables were measured. The focus is on psychological and cognitive variables related to AI use, not on writing competence itself.""}, ""c4"": {""status"": ""fail"", ""evidence"": ""No quantifiable writing outcome metrics (e.g., writing scores, text quality ratings, linguistic measures) are reported. The quantitative data concern self-efficacy and perceived cognitive load, and the qualitative data concern perceptions of AI tools. There is no experimental measure of changes in writing performance attributable to AI use.""}}"
Examining the Impact of Artificial Intelligence (ai) Tools for Saudi Arabian English as a Second Language (esl) Students,2025,exclude,"{""c1"": {""status"": ""pass"", ""evidence"": ""Participants are ESL students at a Saudi Arabian university, explicitly described as ESL learners, with outcomes focused on English writing proficiency.""}, ""c2"": {""status"": ""fail"", ""evidence"": ""The study examines a bundle of AI tools: ChatGPT (LLM-based) plus Grammarly and QuillBot, which are not clearly LLM-based in this context. More importantly, the design is correlational/impact-focused rather than an experimental or quasi-experimental instructional intervention integrating LLMs into writing instruction or processes.""}, ""c3"": {""status"": ""pass"", ""evidence"": ""The primary focus is ESL students\u2019 writing proficiency and writing-related opportunities and challenges when using AI formative feedback tools, which aligns with writing competence as the main context.""}, ""c4"": {""status"": ""fail"", ""evidence"": ""Although quantitative significance values are reported, the study appears to be cross-sectional, examining perceived impact and associations rather than outcomes of a structured LLM-mediated writing intervention. It does not clearly report pre/post or controlled experimental writing outcome measures attributable to an LLM-based intervention.""}}"
Empowering Efl Learning: Leveraging Chatgpt for Lesson Planning and Activity Generation in the Efl Classroom,2025,exclude,"{""c1"": {""status"": ""pass"", ""evidence"": ""The context is an EFL classroom with first-year EFL students in Algeria, and the course is on paragraph writing in English. This fits the target population of L2 English learners in an EFL context.""}, ""c2"": {""status"": ""fail"", ""evidence"": ""ChatGPT is used to generate a lesson plan and activities, and the study investigates EFL writing teachers\u2019 opinions of these materials via a questionnaire. There is no experimental or quasi-experimental design integrating ChatGPT into learners\u2019 writing instruction or processes; it is an evaluation of materials, not an intervention with learners.""}, ""c3"": {""status"": ""fail"", ""evidence"": ""Although the topic is a course on paragraph writing, the primary focus of the study is on the quality and perceived usefulness of ChatGPT-generated lesson plans and activities as judged by teachers, not on learners\u2019 writing competence or writing-related performance outcomes.""}, ""c4"": {""status"": ""fail"", ""evidence"": ""The study reports teachers\u2019 opinions collected via questionnaire and does not report any quantifiable writing outcome metrics for students (e.g., writing scores, accuracy, complexity, fluency) resulting from an LLM-mediated intervention.""}}"
Willm: a System for Academic Writing Improvement Based on Large Language Models,2025,unsure,"{""c1"": {""status"": ""unclear"", ""evidence"": ""The abstract states that the study involved 19 non-native English-speaking participants and focuses on academic writing in English. However, it does not specify whether these learners are in ESL/EFL/ELL instructional contexts (e.g., formal language courses) or are general university students using the tool, so it is unclear if they fit the targeted L2 learner population definition.""}, ""c2"": {""status"": ""pass"", ""evidence"": ""The paper introduces WILLM, explicitly described as a system for academic writing improvement based on Large Language Models (LLMs). A three-week user study indicates an intervention where participants used this LLM-based system, satisfying the requirement for an LLM-mediated writing intervention with an experimental component.""}, ""c3"": {""status"": ""pass"", ""evidence"": ""The system provides context-aware feedback on grammar, vocabulary, coherence, and organization, and integrates quizzes and personalized reviews to enhance long-term writing proficiency. The focus is clearly on improving academic writing competence rather than on automated scoring or non-pedagogical evaluation.""}, ""c4"": {""status"": ""pass"", ""evidence"": ""The abstract reports that the three-week user study demonstrated improvements in grammar and vocabulary scores, which are quantifiable writing-related outcome metrics. Although details of the measures are not given, the presence of measurable score improvements meets the criterion for quantitative writing outcomes.""}}"
Integrating Various Types of Feedback in L2 Writing Instruction: Teachers' and Students' Perspectives,2025,exclude,"{""c1"": {""status"": ""pass"", ""evidence"": ""Participants are 286 tertiary EFL students and 65 teachers in L2 writing classrooms, clearly indicating L2 English learners in an EFL context.""}, ""c2"": {""status"": ""fail"", ""evidence"": ""Although the abstract mentions 'automated feedback' enabled by NLP and AI, it does not specify the use of large language models (e.g., ChatGPT, GPT-4) nor an experimental or quasi-experimental intervention integrating LLMs into writing instruction. The focus is on surveying preferences, not on an LLM-based instructional intervention.""}, ""c3"": {""status"": ""fail"", ""evidence"": ""The primary focus is on teachers\u2019 and students\u2019 perspectives on integrating teacher, peer, and automated feedback and on task complexity and feedback preferences, not on evaluating a pedagogical writing intervention or its impact on writing competence.""}, ""c4"": {""status"": ""fail"", ""evidence"": ""The study is survey-based and reports perceptions, preferences, and correlations; it does not report quantifiable writing outcome metrics (e.g., changes in writing scores or quality) resulting from an LLM-mediated writing intervention.""}}"
Exploring Student Engagement with Artificial Intelligence-guided Chatbot Feedback in Efl Writing: Interactions and Revisions,2025,exclude,"{""c1"": {""status"": ""pass"", ""evidence"": ""Participants are three Chinese university students engaged in English writing learning, clearly an EFL context with English as the target language.""}, ""c2"": {""status"": ""unclear"", ""evidence"": ""The abstract refers to an \u201cAI-guided chatbot\u201d providing feedback, but does not specify that it is a large language model (e.g., ChatGPT/GPT-based or similar transformer LLM). It could be a rule-based or non-LLM chatbot; the underlying technology is not described.""}, ""c3"": {""status"": ""pass"", ""evidence"": ""The focus is on engagement with AI-guided chatbot feedback in English writing learning and second language writing instruction, which aligns with writing competence and writing-related processes.""}, ""c4"": {""status"": ""fail"", ""evidence"": ""This is a multiple-case study examining behavioral, cognitive, and emotional engagement. Data sources are chat records, drafts, and interviews. The abstract reports engagement patterns but does not mention any experimental or quasi-experimental design or quantifiable writing outcome metrics assessing effectiveness of the AI intervention on writing performance.""}}"
Quantum Psychology Approach on Enjoyment as Mediator in Relationship between L2 Flow and Engagement,2025,exclude,"{""c1"": {""status"": ""pass"", ""evidence"": ""Participants are 162 high school students in English as a Foreign Language (EFL) speaking and writing classes, so they are L2 English learners in an EFL context.""}, ""c2"": {""status"": ""fail"", ""evidence"": ""Although the context is described as 'AI-assisted' EFL speaking and writing classes, there is no indication that a specific large language model (e.g., ChatGPT, GPT-4) is integrated as an experimental or quasi-experimental intervention. The study is a quantitative, cross-sectional survey of psychological variables, not an LLM-based instructional intervention.""}, ""c3"": {""status"": ""fail"", ""evidence"": ""The primary focus is on psychological flow, enjoyment, and academic engagement, not on writing competence or writing-related performance variables. Writing is only part of the class context, not the central outcome of interest.""}, ""c4"": {""status"": ""fail"", ""evidence"": ""The study reports path analysis results on flow, enjoyment, and engagement scales. It does not report quantifiable writing outcome metrics (e.g., writing quality, accuracy, complexity) to assess any writing intervention, nor does it describe an LLM-mediated writing intervention.""}}"
Enhancing Students’ L2 Writing by Integrating Artificial Intelligence with Corpus-based Language Pedagogy,2025,exclude,"{""c1"": {""status"": ""pass"", ""evidence"": ""Participants were 50 English as a Foreign Language (EFL) learners majoring in English at an English-Medium Instruction university in China, clearly indicating L2 English learners in an EFL context.""}, ""c2"": {""status"": ""unclear"", ""evidence"": ""The abstract refers only to generic 'AI tools' and does not specify that they are large language model\u2013based (e.g., ChatGPT, GPT-4). They could include non-LLM tools such as grammar checkers or other AI-based applications. Without explicit mention of LLMs or transformer-based generative models, it is not possible to confirm that the intervention integrates LLMs.""}, ""c3"": {""status"": ""pass"", ""evidence"": ""The study focuses on L2 writing revision, integrating AI and corpus tools to support writing development, refine collocations, and revise sentences. The primary context is clearly writing competence and writing-related variables.""}, ""c4"": {""status"": ""fail"", ""evidence"": ""The abstract emphasizes questionnaires, interviews, and analysis of changes made in drafts to explore tool use and learner attitudes. It does not report quantifiable writing outcome metrics (e.g., pre/post writing scores, rubric-based gains) to assess effectiveness of the AI-mediated intervention; instead, it focuses on types of changes and perceptions.""}}"
Effects of Ai Chatbots on Efl Students’ Critical Thinking Skills and Intrinsic Motivation in Argumentative Writing,2025,unsure,"{""c1"": {""status"": ""pass"", ""evidence"": ""Participants were 40 Chinese undergraduates in an EFL context (\u201cintegrating AI chatbots into EFL classroom activities\u201d), so they are L2 English learners and the focus is on English argumentative writing.""}, ""c2"": {""status"": ""unclear"", ""evidence"": ""The intervention uses an \u201cAI chatbot\u201d called Spark Desk for writing activities and AI feedback. However, the abstract does not specify whether Spark Desk is a large language model (e.g., transformer-based generative model like ChatGPT/GPT-4). Without confirmation that Spark Desk is LLM-based, it is unclear if this meets the LLM criterion.""}, ""c3"": {""status"": ""pass"", ""evidence"": ""The context is argumentative writing in an EFL classroom. The chatbot is integrated into writing activities, and outcomes include critical thinking skills in argumentative writing and intrinsic motivation related to writing. The focus is pedagogical, not automated scoring.""}, ""c4"": {""status"": ""pass"", ""evidence"": ""A pretest\u2013posttest quasi-experimental design with control group is used. CTS in argumentative writing is measured with the Illinois Critical Thinking Essay Scoring Rubric, and intrinsic motivation is measured with the Intrinsic Motivation Inventory. Quade\u2019s test reports significant improvements, providing quantifiable outcome metrics.""}}"
Efl Student Engagement with Chatgpt in College Reading Classes Via Prompts and Perceptions,2025,exclude,"{""c1"": {""status"": ""pass"", ""evidence"": ""Participants are EFL university freshmen in college English classes, clearly L2 English learners in an EFL context.""}, ""c2"": {""status"": ""pass"", ""evidence"": ""The study examines EFL students\u2019 interactions with ChatGPT, an LLM, in a college English class. Although mainly exploratory, it integrates ChatGPT into classroom activities and analyzes prompt types and usage over time.""}, ""c3"": {""status"": ""fail"", ""evidence"": ""The primary focus is on prompting practices, interaction patterns, and perceptions in a reading class. Writing is mentioned only as one of several skills (reading, writing, vocabulary, grammar) supported by ChatGPT, without a clear focus on writing competence or a writing-specific intervention.""}, ""c4"": {""status"": ""fail"", ""evidence"": ""No quantifiable writing outcome metrics are reported. The study uses conversation logs, questionnaire data, and qualitative responses to analyze prompt types and perceptions, but does not measure changes in writing performance or related quantitative writing outcomes.""}}"
Generative Ai–mediated Scaffolds for Enhanced Critical Thinking in Efl Writing,2025,unsure,"{""c1"": {""status"": ""pass"", ""evidence"": ""Participants are explicitly described as EFL students in vocational colleges, indicating English is the target L2 in an EFL context: \u201cenhancing critical thinking (CT) in English as a Foreign Language (EFL) writing instruction\u2026 across three vocational colleges, involving 92 students.\u201d""}, ""c2"": {""status"": ""unclear"", ""evidence"": ""The abstract refers to \u201cGenerative AI tools\u201d and \u201cGenAI-CT framework\u201d and \u201cAI interaction logs,\u201d suggesting use of generative AI, but it does not specify that these are large language models (e.g., ChatGPT, GPT-4) as opposed to other generative systems. The nature of the tools (LLM-based vs other AI) is not clearly identified.""}, ""c3"": {""status"": ""unclear"", ""evidence"": ""The context is EFL writing instruction with \u201citerative writing and revision cycles\u201d and student essays, but the primary reported outcomes are critical thinking (CT) dimensions. It is not explicit whether writing competence or writing-related performance (e.g., text quality) is a primary focus of the intervention and analysis, or if writing is mainly a vehicle to measure CT.""}, ""c4"": {""status"": ""unclear"", ""evidence"": ""The study reports \u201cstatistically significant gains across all CT dimensions (p<.001)\u201d but does not state whether any quantitative writing outcome metrics (e.g., writing scores, rubric-based writing quality, accuracy, complexity) were measured. Outcomes appear centered on CT rather than writing performance per se.""}}"
