Title,Year,Decision,Notes
Comparative Analysis of Human Graders and Ai in Assessing Secondary School Efl Journal Writing,2025,exclude,"{""c1"": {""status"": ""pass"", ""evidence"": ""Participants are secondary school EFL students in a private school in Istanbul, clearly indicating L2 English learners in an EFL context.""}, ""c2"": {""status"": ""fail"", ""evidence"": ""The study compares grading and feedback from a GenAI platform and human graders. There is no indication of an experimental or quasi-experimental instructional intervention integrating an LLM into the writing process; the GenAI is used as an assessor, not as part of teaching or practice.""}, ""c3"": {""status"": ""fail"", ""evidence"": ""The primary focus is on assessment\u2014grading performance, consistency, and feedback quality of the GenAI platform versus human graders. This aligns with evaluating AI as an automated essay scoring/feedback system rather than a pedagogical writing intervention aimed at improving writing competence.""}, ""c4"": {""status"": ""fail"", ""evidence"": ""The study does not report quantifiable writing outcome gains attributable to an LLM-mediated intervention. It analyzes agreement in scores and feedback quality, not changes in students\u2019 writing performance over time due to GenAI-supported instruction.""}}"
Thai Efl University Students' Writing in the Digital Age: Error Analysis Revisited,2025,exclude,"{""c1"": {""status"": ""pass"", ""evidence"": ""Participants are explicitly described as Thai EFL university students, i.e., L2 English learners in an EFL context.""}, ""c2"": {""status"": ""fail"", ""evidence"": ""Although the abstract mentions Google Translate and ChatGPT and discusses the impact of digital tools, there is no indication of an experimental or quasi-experimental LLM-based writing intervention. The tools are surveyed as resources students use, not as a structured instructional intervention integrating an LLM.""}, ""c3"": {""status"": ""pass"", ""evidence"": ""The primary focus is on writing (grammatical errors, writing strategies, and writing instruction). The context is clearly writing competence and related variables.""}, ""c4"": {""status"": ""fail"", ""evidence"": ""The study reports error analysis and survey findings but does not describe an LLM-mediated intervention with pre/post or comparative quantitative writing outcome measures. It is observational/descriptive rather than testing the effectiveness of an LLM-based writing intervention.""}}"
Effects of Interaction with Ai-assisted Writing Evaluation on Efl Students' Writing Performance,2025,include,"{""c1"": {""status"": ""pass"", ""evidence"": ""Participants are 30 Omani EFL learners, explicitly described as learning English as a foreign language. The focus is on English writing performance, satisfying the L2 English learner population requirement.""}, ""c2"": {""status"": ""pass"", ""evidence"": ""The intervention uses EditGPT, described as an automated written evaluation feedback instrument providing writing feedback. Given the name and context, it is an LLM-based tool (GPT), and the design is experimental with control and treatment groups receiving different feedback sources.""}, ""c3"": {""status"": ""pass"", ""evidence"": ""The primary focus is on writing performance and feedback on writing. The study compares teacher feedback, EditGPT feedback, and general feedback, clearly embedding the LLM within a pedagogical writing intervention rather than as a pure scoring system.""}, ""c4"": {""status"": ""pass"", ""evidence"": ""The study uses pretest and posttest writing tasks (narration and compare-and-contrast) to measure students\u2019 progress, and reports differential performance across groups. These are quantifiable writing outcome metrics assessing the effectiveness of the LLM-mediated intervention.""}}"
The Effect of Ai-assisted Learning on Efl Writing Proficiency: Quasi-experimental and Cluster Analysis,2025,include,"{""c1"": {""status"": ""pass"", ""evidence"": ""Participants are described as EFL high school students in Dhahran, with proficiency levels A2\u2013B1. The context is clearly English as a foreign language, and the focus is on English writing proficiency.""}, ""c2"": {""status"": ""pass"", ""evidence"": ""The study uses ChatGPT as an AI tool providing real-time feedback on grammar, vocabulary, and coherence during writing practice. It explicitly states a quasi-experimental design with AI-assisted learning, indicating an LLM-based intervention integrated into writing instruction.""}, ""c3"": {""status"": ""pass"", ""evidence"": ""The primary focus is on EFL writing proficiency, assessing five core dimensions of writing (content, organization, vocabulary, language use, mechanics). ChatGPT is used pedagogically to support writing, not merely for automated scoring or system evaluation.""}, ""c4"": {""status"": ""pass"", ""evidence"": ""Quantifiable writing outcomes are reported via pre-test and post-test scores using Jacobs et al.\u2019s (1981) analytical scoring rubric. Statistical analyses (Wilcoxon Signed Rank Test, cluster analysis) show significant gains in content, language use, vocabulary, and total scores.""}}"
Imitating Mistakes in a Learning Companion Ai Agent for Online Peer Learning,2025,exclude,"{""c1"": {""status"": ""unclear"", ""evidence"": ""The abstract mentions a focus on English composition but does not specify that participants are L2 English learners in ESL/EFL/ELL contexts. It could involve general learners or native speakers; the population is not clearly defined.""}, ""c2"": {""status"": ""unclear"", ""evidence"": ""The study develops an AI Agent as a learning companion, but the abstract does not indicate that this agent is based on a large language model (e.g., ChatGPT, GPT-4) or transformer-based generative architecture. It could be another form of AI or rule-based system.""}, ""c3"": {""status"": ""pass"", ""evidence"": ""The study explicitly focuses on English composition and peer learning, which aligns with writing-related instructional contexts. The AI agent is used as a learning companion in writing (English composition).""}, ""c4"": {""status"": ""unclear"", ""evidence"": ""The abstract states that English composition is used as an example to validate the approach but does not mention any experimental or quasi-experimental design with quantifiable writing outcome measures. It is unclear whether writing performance is measured quantitatively.""}}"
The Collaboration of Ai and Teacher in Feedback Provision and Its Impact on Efl Learner's Argumentative Writing,2025,exclude,"{""c1"": {""status"": ""pass"", ""evidence"": ""Participants are 28 tenth-grade EFL learners focusing on English argumentative writing, which fits the ESL/EFL/ELL L2 English learner population criterion.""}, ""c2"": {""status"": ""fail"", ""evidence"": ""The AI tool used is DeepL Write. Based on current knowledge, DeepL Write is primarily a neural machine translation / writing assistance tool and is not clearly identified as an LLM-based, transformer generative model like ChatGPT, GPT-4, Gemini, etc. The abstract does not specify that it is an LLM or generative transformer-based system, so it does not meet the explicit LLM intervention requirement.""}, ""c3"": {""status"": ""pass"", ""evidence"": ""The study explicitly targets English argumentative writing and examines the impact of AI and teacher feedback on writing quality (lexical, grammatical, content, coherence, cohesion), which aligns with a primary focus on writing competence.""}, ""c4"": {""status"": ""pass"", ""evidence"": ""Writing outcomes are quantitatively analyzed using Coh-Metrix across three drafts to compare AI-only versus teacher+AI feedback, providing measurable writing quality metrics.""}}"
Revisiting Trends in Genai-assisted Second Language Writing: Retrospect and Prospect,2025,exclude,"{""c1"": {""status"": ""pass"", ""evidence"": ""The abstract states that GenAI primarily assists learners of English as a second language (ESL), indicating that the synthesized studies focus on L2 English learners in ESL contexts.""}, ""c2"": {""status"": ""fail"", ""evidence"": ""This article is itself a review that synthesizes 73 empirical studies on GenAI-assisted L2 writing. It does not report an original experimental or quasi-experimental intervention integrating LLMs; instead, it summarizes others\u2019 work.""}, ""c3"": {""status"": ""pass"", ""evidence"": ""The focus is explicitly on GenAI-assisted second language writing, including academic writing practices and writing metrics such as content, organization, grammar, and mechanics, which are core writing-related variables.""}, ""c4"": {""status"": ""fail"", ""evidence"": ""Although the abstract mentions that the reviewed studies report effect sizes and focus on writing metrics, this paper does not itself present primary quantitative writing outcome data from an intervention; it is a review article, which is an exclusion category.""}}"
Enhancing Chatgpt-based Writing Research through Effective Prompt Use,2025,exclude,"{""c1"": {""status"": ""unclear"", ""evidence"": ""The abstract mentions 'student essays' but does not specify that the students are L2 English learners in ESL/EFL/ELL contexts. Their language background and learning context are not described.""}, ""c2"": {""status"": ""fail"", ""evidence"": ""ChatGPT is used to identify logical fallacies in student essays and to study prompt design and reliability/validity of its analytical outputs. This is a methodological/case study on tool use, not an experimental or quasi-experimental pedagogical intervention integrating LLMs into writing instruction or writing processes for learners.""}, ""c3"": {""status"": ""fail"", ""evidence"": ""The primary focus is on ChatGPT\u2019s analytical behavior (precision, accuracy, validity) and prompt strategies for research/assessment, not on developing learners\u2019 writing competence or writing-related skills through instruction. It is essentially about using ChatGPT for written assessment/analysis, not a teaching intervention.""}, ""c4"": {""status"": ""fail"", ""evidence"": ""No quantifiable learner writing outcomes are reported. The results concern precision, accuracy, and validity of ChatGPT\u2019s outputs under different prompting conditions, not changes in students\u2019 writing performance or related measurable learning outcomes.""}}"
"Including the Tech, Keeping the Human: Integrating Generative Ai in the Feedback Writing Process",2025,exclude,"{""c1"": {""status"": ""unclear"", ""evidence"": ""The abstract mentions \u2018the language learner\u2019 and \u2018EL/COS student\u2019 at UNSW College, suggesting English learners in a pathway/college context, but it does not clearly specify that participants are L2 English learners in ESL/EFL/ELL contexts or provide language background details.""}, ""c2"": {""status"": ""unclear"", ""evidence"": ""The study integrates \u2018generative AI\u2019 in feedback and sentence-editing tasks, but the abstract does not specify whether the tools are large language models (e.g., ChatGPT/GPT-4) or other AI systems. The design is described as \u2018trialling two highly scaffolded feedback tasks,\u2019 but it is not explicit whether this is an experimental or quasi-experimental intervention with comparison or control conditions.""}, ""c3"": {""status"": ""pass"", ""evidence"": ""The focus is on integrating generative AI into the feedback and editing stages of the writing process, aiming to support language development, feedback literacy, and writing-related skills. This aligns with a primary focus on writing competence and writing-related variables rather than automated scoring.""}, ""c4"": {""status"": ""fail"", ""evidence"": ""The abstract reports \u2018observations from trialling these tasks\u2019 and discusses potential benefits and negative effects, but it does not indicate any quantitative or experimental writing outcome measures (e.g., scores, rubric-based gains, error rates). The outcomes appear to be descriptive/observational rather than quantifiable measures of writing performance.""}}"
Implementing Ai Literacy Teaching in University-level L2 Writing Instruction: Exploring One Pedagogical Approach,2025,exclude,"{""c1"": {""status"": ""pass"", ""evidence"": ""The abstract specifies a \u2018first-year writing course for L2 writers,\u2019 indicating university-level second language learners in an English writing context.""}, ""c2"": {""status"": ""unclear"", ""evidence"": ""The study discusses integrating \u2018GenAI tools\u2019 and AI literacy into L2 writing instruction, but it is not explicit that these are LLMs (e.g., ChatGPT) used as part of an experimental or quasi-experimental intervention. It is framed as a \u2018classroom exploration piece\u2019 and \u2018practitioner account,\u2019 suggesting descriptive rather than experimental design.""}, ""c3"": {""status"": ""pass"", ""evidence"": ""The context is clearly L2 writing instruction, focusing on \u2018L2 writing teaching and learning\u2019 and \u2018uses of GenAI for written and multimodal communication,\u2019 which aligns with writing-related variables.""}, ""c4"": {""status"": ""fail"", ""evidence"": ""The abstract presents a \u2018classroom exploration piece\u2019 and \u2018one pedagogical approach\u2019 with emphasis on AI literacy, trust, and transparency. There is no indication of quantitative writing outcome measures or experimental assessment of writing performance.""}}"
Generative Ai for Learning Languages Other Than English: L2 Writers' Current Uses and Perceptions of Ethics,2025,exclude,"{""c1"": {""status"": ""fail"", ""evidence"": ""Participants are L2 learners of five languages other than English (LOTEs). The focus is explicitly on writing in languages other than English, not on L2 English learners in ESL/EFL/ELL contexts.""}, ""c2"": {""status"": ""unclear"", ""evidence"": ""The study concerns learners\u2019 self-initiated uses of generative AI tools, but it does not clearly describe an experimental or quasi-experimental instructional intervention integrating specific LLMs into writing instruction. It appears more observational/survey-based.""}, ""c3"": {""status"": ""pass"", ""evidence"": ""The context is L2 writing in LOTEs, focusing on how learners use GenAI tools for writing and their ethical perceptions. Writing use is central, not automated scoring or purely technical evaluation.""}, ""c4"": {""status"": ""fail"", ""evidence"": ""The abstract reports survey findings on frequency and types of GenAI use and ethical beliefs, but does not indicate any quantifiable writing outcome measures (e.g., changes in writing quality, accuracy, complexity) resulting from an intervention.""}}"
Structured or Semi-structured? the Use of Reflection Journals in Postgraduates' Generative Artificial Intelligence Literacy Development in an L2 Academic Writing Context,2025,exclude,"{""c1"": {""status"": ""pass"", ""evidence"": ""The study is conducted in an L2 academic writing context with postgraduate students, indicating participants are L2 English learners engaged in English academic writing.""}, ""c2"": {""status"": ""fail"", ""evidence"": ""Although the study involves GenAI-assisted writing tasks and GenAI tools (implying LLMs), the experimental manipulation focuses on types of reflection journals (structured vs semi-structured) to develop GenAI literacy, not on differing LLM-based writing interventions themselves.""}, ""c3"": {""status"": ""fail"", ""evidence"": ""The primary outcome is GenAI literacy (operational competence, ethics, critical evaluation, reflection). Writing competence or writing-related performance is not the main focus; GenAI is used as context rather than as a targeted writing skill intervention.""}, ""c4"": {""status"": ""fail"", ""evidence"": ""The study reports quantitative outcomes on GenAI literacy dimensions, not on writing quality or other quantifiable writing performance metrics. No experimental writing outcome measures (e.g., scores, complexity, accuracy, fluency) are described in the abstract.""}}"
Interacting with Chatgpt for Internal Feedback and Factors Affecting Feedback Quality,2025,exclude,"{""c1"": {""status"": ""pass"", ""evidence"": ""Participants were 48 Chinese students in an English writing course, clearly L2 English learners in an EFL context.""}, ""c2"": {""status"": ""pass"", ""evidence"": ""The study examines students\u2019 interaction with ChatGPT (a Generative Pre-Trained Transformer) to generate internal feedback during an English writing course, so an LLM is integrated into the writing process, albeit in a qualitative case-study design.""}, ""c3"": {""status"": ""pass"", ""evidence"": ""The context is explicitly L2 writing: students in an English writing course use ChatGPT for feedback related to their writing, and the focus is on feedback processes in L2 writing.""}, ""c4"": {""status"": ""fail"", ""evidence"": ""The study is described as a qualitative case study using self-reflective questions, interviews, and conversation logs, analyzed via thematic coding. The abstract reports no experimental or quasi-experimental design and no quantifiable writing outcome metrics; it focuses on experiences, factors affecting feedback quality, and qualitative insights.""}}"
Artificial Intelligence Tools for Research Writing: Practical Tips for Teachers,2025,exclude,"{""c1"": {""status"": ""unclear"", ""evidence"": ""The abstract does not specify the learner population, language background, or whether students are L2 English learners in ESL/EFL/ELL contexts. It appears to be a general discussion of students and teachers without a defined L2 English population.""}, ""c2"": {""status"": ""fail"", ""evidence"": ""The paper discusses \u201cartificial intelligence (AI) tools\u201d in general (content generation, literature review, editing, citation management) and offers practical tips. It does not specify the use of large language models (e.g., ChatGPT, GPT-4) nor describe an experimental or quasi-experimental intervention design; it appears to be conceptual/instructional guidance.""}, ""c3"": {""status"": ""fail"", ""evidence"": ""Although the focus is on research writing, the article is framed as an exploration of tools and instructional strategies rather than an empirical study of a writing intervention\u2019s effects. It is more of a practical/overview piece than a study centered on measuring changes in writing competence.""}, ""c4"": {""status"": ""fail"", ""evidence"": ""No quantifiable writing outcome metrics or experimental results are mentioned. The abstract describes benefits and strategies but does not report measured changes in writing performance or related variables.""}}"
Exploring the Use of Chatgpt-generated Model Texts as a Feedback Instrument: Efl Students' Text Quality and Perceptions,2025,include,"{""c1"": {""status"": ""pass"", ""evidence"": ""Participants were 104 Chinese high school EFL students, i.e., learners of English as a foreign language. The focus is explicitly on EFL students\u2019 English writing quality (content, organisation, vocabulary, grammar).""}, ""c2"": {""status"": ""pass"", ""evidence"": ""The intervention uses ChatGPT-generated model texts as a feedback instrument for writing. ChatGPT is a large language model, and the study employs a quasi-experimental design with control and experimental groups comparing human- vs ChatGPT-generated model texts.""}, ""c3"": {""status"": ""pass"", ""evidence"": ""The primary focus is on EFL writing competence: effects of ChatGPT-generated model texts on students\u2019 text quality (content, organisation, vocabulary, grammar) and their use as feedback in writing classrooms. This is a pedagogical writing intervention, not automated scoring.""}, ""c4"": {""status"": ""pass"", ""evidence"": ""The study uses a pretest\u2013post-test quasi-experimental design and reports analytical measures of text quality (content, organisation, vocabulary, grammar) with descriptive and inferential statistics, providing quantifiable writing outcome metrics.""}}"
Leveraging Chatgpt for Research Writing: an Exploration of Esl Graduate Students' Practices,2025,exclude,"{""c1"": {""status"": ""pass"", ""evidence"": ""Participants are explicitly described as two ESL graduate students, indicating L2 English learners in an ESL context, and the focus is on their English research writing.""}, ""c2"": {""status"": ""fail"", ""evidence"": ""Although ChatGPT (an LLM) is central, the design is a case study of naturally occurring use after a tutorial, not an experimental or quasi-experimental intervention. There is no controlled instructional treatment or comparison condition to test the effect of an LLM-based writing intervention.""}, ""c3"": {""status"": ""pass"", ""evidence"": ""The study focuses on research writing practices (genre, content, language use, documentation, coherence, clarity) and how ChatGPT is integrated into academic writing processes, which aligns with writing competence and writing-related variables.""}, ""c4"": {""status"": ""fail"", ""evidence"": ""The abstract reports qualitative findings about practices, integrity, and agency but does not mention any quantifiable writing outcome metrics (e.g., scores, rubric-based gains, measurable changes in writing quality) to assess effectiveness of the LLM-mediated intervention.""}}"
Efl Students' Use of Ai Chatbots in Academic Writing,2025,exclude,"{""c1"": {""status"": ""pass"", ""evidence"": ""Participants are described as students in a university-level English as a Foreign Language (EFL) class at a French university, clearly indicating L2 English learners in an EFL context.""}, ""c2"": {""status"": ""unclear"", ""evidence"": ""The abstract states that students were trained to use AI chatbots for feedback on their writing. However, it does not specify that these are large language model-based tools (e.g., ChatGPT, GPT-4), nor does it clearly describe an experimental or quasi-experimental design; it appears more exploratory/observational.""}, ""c3"": {""status"": ""pass"", ""evidence"": ""The context is an academic writing unit in an EFL class, and the focus is on how students use chatbot feedback in their writing, including grammar, word choice, and style. This aligns with writing competence and writing-related variables.""}, ""c4"": {""status"": ""fail"", ""evidence"": ""The study reports that students\u2019 responses were coded to identify patterns in how they used chatbot feedback and discusses hesitancy to accept certain changes. There is no indication of quantifiable writing outcome metrics (e.g., pre/post writing scores, measurable improvement); the outcomes are qualitative patterns and perceptions.""}}"
Ai-powered Digital Tools for Vocabulary Retention in Foreign Language Learners: a Perception-based Study,2025,exclude,"{""c1"": {""status"": ""pass"", ""evidence"": ""Participants are students in an Ecuadorian university program where English is taught as a foreign language, i.e., EFL learners, so the population matches L2 English learners.""}, ""c2"": {""status"": ""fail"", ""evidence"": ""Although students use AI tools including ChatGPT, the study is a quantitative, descriptive, perception-based survey. There is no experimental or quasi-experimental design integrating LLMs into instruction; it only surveys prior use and perceptions.""}, ""c3"": {""status"": ""fail"", ""evidence"": ""The primary focus is vocabulary retention and general language learning (including some mention of writing accuracy), not a structured writing intervention or writing-focused pedagogy. Writing is incidental rather than the main context.""}, ""c4"": {""status"": ""fail"", ""evidence"": ""Outcomes are self-reported perceptions (e.g., perceived better retention, improved writing accuracy, increased motivation) collected via survey. No quantifiable writing performance measures or experimental writing outcomes are reported.""}}"
Translanguaging with Generative Ai in Efl Writing: Students' Practices and Perceptions,2025,exclude,"{""c1"": {""status"": ""pass"", ""evidence"": ""Participants are EFL students in China (six college students with lower to intermediate proficiency), clearly L2 English learners in an EFL context.""}, ""c2"": {""status"": ""fail"", ""evidence"": ""Although the study involves generative AI (ERNIE Bot), it is a qualitative exploration of how students use the tool and their perceptions. There is no indication of an experimental or quasi-experimental design or a structured pedagogical intervention integrating the LLM into instruction.""}, ""c3"": {""status"": ""pass"", ""evidence"": ""The focus is on EFL writing processes and how generative AI is used in writing, framed through translanguaging practices. This aligns with a writing-related context.""}, ""c4"": {""status"": ""fail"", ""evidence"": ""The abstract describes a qualitative study using interviews and artefacts, focusing on practices and perceptions. It does not report quantifiable writing outcome metrics or experimental measures of writing improvement.""}}"
