Title,Year,Decision,Notes
Chatgpt as an Ai L2 Teaching Support: a Case Study of an Efl Teacher,2024,exclude,"{""c1"": {""status"": ""unclear"", ""evidence"": ""The context is an EFL class in Spain, so it is likely that learners are L2 English users. However, the study is framed around an EFL teacher as the focal case, and the abstract does not explicitly describe learner participants or their characteristics.""}, ""c2"": {""status"": ""fail"", ""evidence"": ""This is an exploratory single instrumental case study of one EFL teacher using ChatGPT as teaching support. The focus is on how ChatGPT assists the teacher in planning, designing lessons, and assessing writing, not on an experimental or quasi-experimental intervention measuring its impact on learners\u2019 writing. There is no indication of controlled or structured LLM-mediated instructional intervention with outcome comparison.""}, ""c3"": {""status"": ""fail"", ""evidence"": ""Although writing is mentioned (assessing learners\u2019 writing), the primary focus is on ChatGPT as a support tool for teachers (lesson planning, design, implementation) and on reliability/helpfulness of outputs. The study does not center on developing learners\u2019 writing competence through a pedagogical intervention, but on teacher use and perceptions.""}, ""c4"": {""status"": ""fail"", ""evidence"": ""The study uses qualitative thematic analysis and a semi-structured interview to explore support, reliability, and helpfulness. It does not report quantifiable writing outcome metrics for learners or any experimental measures of writing improvement attributable to ChatGPT.""}}"
"4th International Conference on Digital Technologies and Applications, Icdta 2024",2024,exclude,"{""c1"": {""status"": ""fail"", ""evidence"": ""This is a conference proceedings volume containing 53 papers across diverse topics in digital technologies. The abstract does not specify any individual study focused on L2 English learners in ESL/EFL/ELL contexts; it only lists various paper titles, most of which are unrelated to language learning. Therefore, the population criterion is not met for this aggregated entry.""}, ""c2"": {""status"": ""fail"", ""evidence"": ""Although one listed paper mentions AI and academic writing and another mentions ChatGPT as a learning tool, the proceedings abstract does not indicate that any specific study uses an LLM-based intervention in writing instruction with an experimental or quasi-experimental design. As a whole, this proceedings entry is not an LLM-based writing intervention study.""}, ""c3"": {""status"": ""fail"", ""evidence"": ""The primary focus of the proceedings is broad digital technologies and applications (e.g., data mining, cybersecurity, antennas, investment decision-making). Writing competence or writing-related variables are not the central focus of the volume; any writing-related work is incidental and not described as a pedagogical writing intervention.""}, ""c4"": {""status"": ""fail"", ""evidence"": ""No quantifiable writing outcome metrics are reported in the abstract. The proceedings description does not present experimental results or structured intervention outcomes related to LLM-mediated writing; it only lists paper titles and general themes.""}}"
Revolutionizing English Language Learning with Ai: Boosting Student Receptive and Productive Skills,2024,exclude,"{""c1"": {""status"": ""pass"", ""evidence"": ""Participants are 183 EFL undergraduate students from three universities, clearly indicating L2 English learners in an EFL context.""}, ""c2"": {""status"": ""fail"", ""evidence"": ""The study evaluates three AI tools (Turboscribe, Gliglish, Jenni) via a survey based on TAM. There is no indication these are LLM-based writing interventions or that an experimental/quasi-experimental instructional design integrating LLMs into writing instruction was implemented.""}, ""c3"": {""status"": ""fail"", ""evidence"": ""The focus is on overall English skills (listening, reading, speaking, and writing) and technology acceptance/behavioral intent, not specifically on writing competence or a writing-focused pedagogical intervention.""}, ""c4"": {""status"": ""fail"", ""evidence"": ""Outcomes reported are perceptions (user-friendliness, behavioral intent, perceived benefits) from a survey. No quantifiable writing performance metrics or measured changes in writing quality are reported.""}}"
Second Language Writing Anxiety and Chatgpt Adoption as an Automated Writing Evaluation Tool,2024,exclude,"{""c1"": {""status"": ""pass"", ""evidence"": ""Participants are described as 'English second language learners' (639 undergraduate students), indicating an L2 English population in an academic context.""}, ""c2"": {""status"": ""fail"", ""evidence"": ""The study is a cross-sectional survey using TAM and SEM-PLS to examine intention to use ChatGPT. There is no experimental or quasi-experimental integration of ChatGPT into instruction or actual writing processes; ChatGPT is only considered as a potential tool.""}, ""c3"": {""status"": ""fail"", ""evidence"": ""The focus is on writing anxiety and technology acceptance (perceived usefulness, ease of use, attitude, intention) regarding ChatGPT as an automated writing evaluation tool, not on a pedagogical writing intervention or measured changes in writing competence.""}, ""c4"": {""status"": ""fail"", ""evidence"": ""No quantifiable writing outcome metrics are reported. Outcomes are psychological/attitudinal (writing anxiety, perceived usefulness, perceived ease of use, attitude, intention to use), with no assessment of writing performance or quality.""}}"
The Impact of Using Chatgpt on Efl Students' Writing,2024,exclude,"{""c1"": {""status"": ""pass"", ""evidence"": ""The participants are explicitly described as English as a foreign language (EFL) learners, and the focus is on English writing, satisfying the population criterion.""}, ""c2"": {""status"": ""pass"", ""evidence"": ""The study investigates the impact of ChatGPT, a large language model, on EFL learners\u2019 writing by comparing outlines written with and without ChatGPT assistance, indicating an LLM-based writing intervention.""}, ""c3"": {""status"": ""pass"", ""evidence"": ""The focus is on writing-related variables: logical structure, content enrichment, vocabulary and grammar polishing, and overall writing ability. ChatGPT is used as a pedagogical tool in the writing process, not merely for scoring.""}, ""c4"": {""status"": ""fail"", ""evidence"": ""The abstract reports discourse analysis results and qualitative improvements (logical structure, content, vocabulary, grammar) and student reflections, but does not indicate any quantitative or experimental outcome measures (e.g., scores, rubric-based ratings, statistical comparisons). Outcomes appear qualitative only, which does not meet the requirement for quantifiable writing outcome metrics.""}}"
Revolutionizing Efl Writing: Unveiling the Strategic Use of Chatgpt by Indonesian Master’s Students,2024,exclude,"{""c1"": {""status"": ""pass"", ""evidence"": ""Participants are postgraduate EFL students (Master\u2019s degree students from Indonesian universities), clearly indicating L2 English learners in an EFL context.""}, ""c2"": {""status"": ""fail"", ""evidence"": ""The study is a qualitative case study exploring students\u2019 experiences and strategies in using ChatGPT. There is no indication of an experimental or quasi-experimental design, nor a structured instructional intervention integrating ChatGPT; it is descriptive/experiential.""}, ""c3"": {""status"": ""pass"", ""evidence"": ""The focus is on EFL students\u2019 use of ChatGPT throughout their writing process, including vocabulary, grammar, idea generation, essay structuring, and language refinement\u2014clearly centered on writing competence and related variables.""}, ""c4"": {""status"": ""fail"", ""evidence"": ""The abstract reports perceptions and self-reported experiences, with no mention of quantifiable writing outcome metrics or measured pre/post changes in writing performance. It is purely qualitative.""}}"
Nurturing Responsible Ai Practices in L2 Writing: Empowering Student Voices,2024,exclude,"{""c1"": {""status"": ""pass"", ""evidence"": ""Participants are students in a freshman academic writing course at an English-medium American university in the UAE, indicating L2 English learners in an EFL/ESL context with focus on English academic writing.""}, ""c2"": {""status"": ""unclear"", ""evidence"": ""The abstract refers broadly to \u2018Artificial Intelligence (AI)\u2019 and \u2018AI-generated texts\u2019 but does not specify that the tools are large language models (e.g., ChatGPT, GPT-4). It may include LLMs, but this is not explicit from the title/abstract alone.""}, ""c3"": {""status"": ""fail"", ""evidence"": ""The primary focus is on responsible and ethical AI integration, digital literacy, learner autonomy, and policy development. Collaborative writing assignments involve contrastive analysis of human vs AI-generated texts, but the intervention is about digital literacy and policy-making rather than improving writing competence through AI-mediated instruction.""}, ""c4"": {""status"": ""fail"", ""evidence"": ""The study uses mixed methods with surveys and analysis of assignments, but the abstract does not report or indicate quantifiable writing outcome metrics (e.g., writing scores, quality measures) to assess effectiveness of AI-mediated writing intervention. Outcomes are framed in terms of digital literacy and policy engagement.""}}"
"Leveraging Chatgpt to Enhance Students’ Writing Skills, Engagement, and Feedback Literacy",2024,include,"{""c1"": {""status"": ""pass"", ""evidence"": ""Participants are 50 Indonesian university students in an English as a Foreign Language (EFL) Economic English course. The context is clearly English language learning (ELT/EFL), satisfying the L2 English learner population criterion.""}, ""c2"": {""status"": ""pass"", ""evidence"": ""The title specifies \u2018Leveraging ChatGPT\u2019 and the abstract refers to \u2018AI chatbots\u2019 used by the experimental group. ChatGPT is an LLM-based chatbot. The design is experimental with an experimental and control group, integrating the chatbot into students\u2019 writing-related learning.""}, ""c3"": {""status"": ""pass"", ""evidence"": ""The study\u2019s primary focus is on EFL students\u2019 writing: it aims to measure how AI chatbots affect writing learning outcomes, feedback literacy, and engagement in writing. This is a pedagogical intervention in writing, not an automated scoring or purely functional evaluation.""}, ""c4"": {""status"": ""pass"", ""evidence"": ""The abstract states that the study measures \u2018writing learning outcomes\u2019 using tests and reports that the experimental group showed \u2018significant improvements in writing outcomes.\u2019 This indicates quantifiable writing outcome metrics within an experimental design.""}}"
The Impact of Chatgpt Feedback on the Development of Efl Students’ Writing Skills,2024,include,"{""c1"": {""status"": ""pass"", ""evidence"": ""Participants are 110 university students learning English as a Foreign Language (EFL), clearly indicating L2 English learners in an EFL context.""}, ""c2"": {""status"": ""pass"", ""evidence"": ""The study uses ChatGPT feedback as the core intervention within a quasi-experimental design to enhance students\u2019 writing skills, indicating integration of an LLM (ChatGPT) into writing instruction.""}, ""c3"": {""status"": ""pass"", ""evidence"": ""The primary focus is on writing competence: the impact of ChatGPT feedback on students\u2019 writing proficiency and specific writing aspects (conciseness, grammar, inclusion of key information, passive voice).""}, ""c4"": {""status"": ""pass"", ""evidence"": ""The study employs pre-tests and post-tests to evaluate writing proficiency and reports significant quantitative improvements in specific writing features, providing measurable writing outcome metrics.""}}"
Exploring the Attitudes of Efl University Instructors and Students Toward Utilizing Chatgpt for Acquiring Writing Fluency and Accuracy Skills,2024,exclude,"{""c1"": {""status"": ""pass"", ""evidence"": ""Participants are EFL university instructors and students at a private university in Sharjah, clearly indicating an English-as-a-foreign-language context focused on English writing fluency and accuracy.""}, ""c2"": {""status"": ""fail"", ""evidence"": ""Although ChatGPT (an LLM) is the focal tool, the study is described as exploring attitudes toward its use. The methods mention only a Likert-scale questionnaire and semi-structured interviews; there is no indication of an experimental or quasi-experimental instructional intervention integrating ChatGPT into actual writing instruction or tasks.""}, ""c3"": {""status"": ""fail"", ""evidence"": ""The primary focus is on attitudes toward using ChatGPT to enhance writing fluency and accuracy, not on a structured pedagogical intervention or measured changes in writing competence. It is essentially an attitudinal/perception study rather than an intervention study.""}, ""c4"": {""status"": ""fail"", ""evidence"": ""Outcomes reported are perceptions (attitudes) gathered via questionnaires and interviews. There is no mention of quantifiable writing performance metrics (e.g., scores, rubric-based assessments, pre/post writing tests) to evaluate the effectiveness of ChatGPT-mediated writing intervention.""}}"
Usability Study of Genai for English Learning in Vr,2024,exclude,"{""c1"": {""status"": ""pass"", ""evidence"": ""Participants are described as \u201c7 undergraduate non-native English speakers,\u201d which fits L2 English learners in a higher-education EFL/ESL context.""}, ""c2"": {""status"": ""pass"", ""evidence"": ""The intervention uses a VR conversation game, EasyEnglish, with GenAI NPCs and a large language model for language assessment and feedback (grammar, vocabulary correction, suggestions). This is an LLM-based instructional tool.""}, ""c3"": {""status"": ""fail"", ""evidence"": ""The primary focus is on speaking practice in VR and system usability (SUS) and content validity (CVI). Writing competence or writing-related variables are not mentioned; the LLM is used for spoken conversation and assessment, not writing instruction.""}, ""c4"": {""status"": ""fail"", ""evidence"": ""The study reports SUS and CVI scores and qualitative system performance (e.g., diverse responses, grammar correction), but no quantifiable writing outcomes or writing performance measures are provided.""}}"
Exploring the Use of Generative Ai in Student-produced Efl Podcasts: a Qualitative Study,2024,exclude,"{""c1"": {""status"": ""pass"", ""evidence"": ""Participants are university English as a Foreign Language (EFL) students, clearly indicating L2 English learners in an EFL context.""}, ""c2"": {""status"": ""unclear"", ""evidence"": ""The abstract refers to \u201cgenerative AI tools\u201d and \u201cGenerative AI-based technologies\u201d but does not specify whether these are large language models (e.g., ChatGPT, GPT-4) or other generative tools (e.g., audio, editing, or non-LLM systems). The design is qualitative, based on open-ended responses, not an experimental or quasi-experimental intervention study.""}, ""c3"": {""status"": ""fail"", ""evidence"": ""The primary focus is on student-produced EFL podcasts and spoken language quality, with generative AI used across podcast aspects (ideas, script, editing). The outcomes emphasize spoken language and podcast production rather than writing competence or writing-related variables as the main focus.""}, ""c4"": {""status"": ""fail"", ""evidence"": ""The study is explicitly qualitative, using thematic analysis of open-ended responses. It reports perceptions and implications but does not mention any quantifiable writing outcome metrics or experimental measures of writing performance.""}}"
Utilizing Elsa Speak and Busuu Apps to Enhance English for Professional Purposes among Indian Students: an Education 4.0 Approach,2024,exclude,"{""c1"": {""status"": ""pass"", ""evidence"": ""Participants are Indian students learning English for professional purposes in a multilingual context, fitting an ESL/EFL/ELL population focus on English communication skills.""}, ""c2"": {""status"": ""fail"", ""evidence"": ""The intervention uses ELSA Speak and Busuu apps framed under Education 4.0. These are general language learning platforms and the abstract does not indicate that they are LLM-based (e.g., ChatGPT, GPT-4) or that transformer-based generative models are integrated into writing instruction.""}, ""c3"": {""status"": ""fail"", ""evidence"": ""The study targets overall professional English communication, reporting gains in listening, speaking, reading, and writing. Writing is only one of several skills and there is no indication that the primary focus is on writing competence or writing-related variables specifically.""}, ""c4"": {""status"": ""unclear"", ""evidence"": ""The abstract reports significant improvement in listening, speaking, reading, and writing skills based on pre- and post-questionnaires, but it is unclear whether there are specific, quantifiable writing outcome metrics (e.g., writing quality scores) as opposed to general self-reported communication measures.""}}"
Using Generative Ai to Provide High-quality Lexicographic Assistance to Chinese Learners of English; Die Gebruik Van Generatiewe Ki Om Hoëkwaliteit Leksikografiese Hulp Aan Chinese Aanleerders Van Engels Te Bied,2024,exclude,"{""c1"": {""status"": ""pass"", ""evidence"": ""The study explicitly targets Chinese learners of English, i.e., L2 English learners in an EFL context: \u201cwriting assistants for Chinese learners of English.\u201d""}, ""c2"": {""status"": ""fail"", ""evidence"": ""Although generative AI (ChatGPT, Ernie Bot) is used, it is employed to generate lexicographic explanations and error subcategory descriptions, not as an experimental or quasi-experimental pedagogical intervention with learners. The focus is on tool/content development and comparison of chatbots, not on an LLM-mediated instructional treatment with participants.""}, ""c3"": {""status"": ""fail"", ""evidence"": ""The primary focus is lexicographic assistance and error explanation design (subject\u2013verb disagreement) and the potential integration of generative AI into writing assistants, rather than an implemented writing intervention measuring changes in writing competence. It is conceptual/methodological, not a study of writing instruction outcomes.""}, ""c4"": {""status"": ""fail"", ""evidence"": ""No quantifiable writing outcome metrics or experimental results with learners are reported in the abstract. The paper discusses chatbot performance and the need for human supervision, but not measured effects on learners\u2019 writing quality or related variables.""}}"
Investigating Chinese Learners ' Use and Perceptions of Chatgpt in Eap,2024,exclude,"{""c1"": {""status"": ""pass"", ""evidence"": ""Participants are Chinese learners in an English for Academic Purposes (EAP) context, which implies they are L2 English learners in an EFL setting.""}, ""c2"": {""status"": ""fail"", ""evidence"": ""The study investigates learners\u2019 use and perceptions of ChatGPT via questionnaire and interviews. There is no indication of an experimental or quasi-experimental pedagogical intervention integrating ChatGPT into instruction; it is a descriptive/perceptual study.""}, ""c3"": {""status"": ""unclear"", ""evidence"": ""Students report using ChatGPT for academic vocabulary and academic writing, but the study\u2019s primary focus is on perceptions and usage patterns, not on a structured writing intervention or instructional design targeting writing competence.""}, ""c4"": {""status"": ""fail"", ""evidence"": ""The abstract reports no quantitative writing outcome measures (e.g., writing scores, text quality metrics). It focuses on attitudes and perceived uses, without assessing changes in writing performance.""}}"
Using Ai Tools to Enhance Academic Writing and Maintain Academic Integrity,2024,exclude,"{""c1"": {""status"": ""pass"", ""evidence"": ""Participants are undergraduate students whose first language was not English, i.e., L2 English learners in higher education, fitting ESL/EFL/ELL-type contexts.""}, ""c2"": {""status"": ""fail"", ""evidence"": ""The study explores students\u2019 perceptions of paraphrasing and AI tools but does not describe an experimental or quasi-experimental intervention integrating a specific LLM (e.g., ChatGPT) into writing instruction or processes. It is a perception-focused qualitative study.""}, ""c3"": {""status"": ""unclear"", ""evidence"": ""The context involves academic writing, plagiarism, and use of AI tools in higher education, but the focus is on perceptions rather than a structured pedagogical writing intervention.""}, ""c4"": {""status"": ""fail"", ""evidence"": ""The abstract states that data were analyzed using qualitative methods and does not mention any quantifiable writing outcome metrics or experimental measures of writing performance.""}}"
Chatgpt as a Tool to Improve Written Expression in English as a Foreign Language; Chatgpt Comme Outil D’amélioration De L’expression Écrite En Anglais Langue Étrangère; Chatgpt Como Uma Ferramenta Para Aprimorar a Expressão Escrita No Inglês Língua Estrangeira; Chatgpt Como Herramienta Para Mejorar La Expresión Escrita En Inglés Como Lengua Extranjera,2024,exclude,"{""c1"": {""status"": ""pass"", ""evidence"": ""The title and abstract indicate the focus is on written expression in English as a foreign language in higher education, implying EFL learners using English as an L2.""}, ""c2"": {""status"": ""pass"", ""evidence"": ""ChatGPT, a large language model, is explicitly used as an aid for academic writing and for correcting and improving written expression in English essays.""}, ""c3"": {""status"": ""pass"", ""evidence"": ""The context is clearly writing-focused: students perform a writing task in the essay genre, and ChatGPT is used to correct and improve written expression (vocabulary, grammar, text structure, content).""}, ""c4"": {""status"": ""fail"", ""evidence"": ""The abstract describes a detailed analysis of students\u2019 interactions with ChatGPT and highlights mistakes and correct answers provided by the tool, but it does not indicate any experimental or quasi-experimental design with quantifiable writing outcome metrics (e.g., pre/post writing scores, rubric-based gains). The focus appears to be on tool performance and possibilities, not measured learner writing improvement.""}}"
Utilising Artificial Intelligence-enhanced Writing Mediation to Develop Academic Writing Skills in Efl Learners: a Qualitative Study,2024,exclude,"{""c1"": {""status"": ""pass"", ""evidence"": ""Participants are explicitly described as EFL learners preparing for the IELTS examination, i.e., L2 English learners in an EFL context.""}, ""c2"": {""status"": ""pass"", ""evidence"": ""The intervention uses ChatGPT, clearly an LLM-based AI platform, integrated into interactive writing activities where learners receive implicit and explicit writing mediation.""}, ""c3"": {""status"": ""pass"", ""evidence"": ""The focus is on developing EFL learners\u2019 academic writing skills via AI-enhanced writing mediation and interactive writing activities, aligning with writing competence as the primary outcome domain.""}, ""c4"": {""status"": ""fail"", ""evidence"": ""The study is explicitly described as a qualitative research design using microgenetic tracking, observations, reflexive journal, and think-aloud interviews. The abstract reports perceived development and positive attitudes but does not indicate any quantifiable writing outcome metrics or experimental/quasi-experimental measures of effectiveness.""}}"
Does It Really Help? Exploring the Impact of Al-generated Writing Assistant on the Students’ English Writing,2024,exclude,"{""c1"": {""status"": ""pass"", ""evidence"": ""Participants are described as four seventh-semester EFL students, clearly indicating L2 English learners in an EFL context.""}, ""c2"": {""status"": ""fail"", ""evidence"": ""The study evaluates an \u201cAI-generated writing assistant\u2026 ParagraphAI text generator,\u201d but the abstract does not specify that it is a large language model (e.g., ChatGPT/GPT-like transformer-based generative model). It is treated as generic AI-powered writing software, and there is no clear indication it is an LLM-based intervention as required.""}, ""c3"": {""status"": ""pass"", ""evidence"": ""The focus is explicitly on English writing skills, including grammatical errors, cohesion, coherence, and content density, which are core writing-related variables.""}, ""c4"": {""status"": ""pass"", ""evidence"": ""The study uses tests, questionnaires, and text comparison to measure Lexical Diversity indices and reports effects on grammatical accuracy, cohesion, and coherence, indicating quantifiable writing outcome metrics.""}}"
